[
  {
    "ticket_id": "INC-5001",
    "subject": "Re: Re: Re: Re: Re: FW: VPN disconnects during market open",
    "description": "Hi IT Support,\n\nJust following up again \u2014 the VPN still drops every morning between 09:28 and 09:32 ET.\nI have to reconnect 3-4 times before it stabilizes. This is impacting my ability to\nexecute trades at market open.\n\nThanks,\nMarco\n\n--- Original Message ---\nFrom: Marco Bellini <marco.bellini@contoso.com>\nSent: Monday, March 10, 2026 8:45 AM\nTo: IT Support <itsupport@contoso.com>\nSubject: Re: Re: Re: Re: FW: VPN disconnects during market open\n\nStill happening today. I ran the diagnostics you asked for \u2014 attached.\n\n--- Original Message ---\nFrom: IT Support <itsupport@contoso.com>\nSent: Friday, March 7, 2026 4:10 PM\nTo: Marco Bellini <marco.bellini@contoso.com>\nSubject: Re: Re: Re: FW: VPN disconnects during market open\n\nHi Marco, could you run 'netsh wlan show all' and send us the output? Also please\nconfirm your GlobalProtect client version. Thanks, Amy\n\n--- Original Message ---\nFrom: Marco Bellini <marco.bellini@contoso.com>\nSent: Friday, March 7, 2026 9:05 AM\nTo: IT Support <itsupport@contoso.com>\nSubject: Re: Re: FW: VPN disconnects during market open\n\nIt happened again. I lost the VPN tunnel at exactly 09:30. My colleague Raj in the\nsame building says his works fine, so I don't think it's the office network.\n\n--- Original Message ---\nFrom: IT Support <itsupport@contoso.com>\nSent: Thursday, March 6, 2026 3:00 PM\nTo: Marco Bellini <marco.bellini@contoso.com>\nSubject: Re: FW: VPN disconnects during market open\n\nHi Marco, thanks for reporting. Can you tell us which office and floor you're on?\nAlso, are you on Wi-Fi or Ethernet? Regards, Amy\n\n--- Original Message ---\nFrom: Marco Bellini <marco.bellini@contoso.com>\nSent: Thursday, March 6, 2026 9:35 AM\nTo: IT Support <itsupport@contoso.com>\nSubject: FW: VPN disconnects during market open\n\nHi team, my VPN keeps disconnecting every morning around market open. I'm on the\n5th floor, Building 3, New York office, using Wi-Fi. It's been going on for a week.",
    "reporter": {
      "name": "Marco Bellini",
      "email": "marco.bellini@contoso.com",
      "department": "Equity Trading"
    },
    "created_at": "2026-03-18T09:00:00Z",
    "channel": "email",
    "attachments": []
  },
  {
    "ticket_id": "INC-5002",
    "subject": "Monitor flickering \u2014 screenshot attached inline",
    "description": "Hi,\n\nMy external monitor keeps flickering every few seconds. I took a screenshot but our\nmail client embedded it inline. Here it is:\n\n[image: screenshot.png]\ndata:image/png;base64,iVBORw0KGgoAAAANSUhEUgAAAAEAAAABCAYAAAAfFcSJAAAADUlEQVR42mNk+M9QDwADhgGAWjR9awAAAABJRU5ErkJggg==\ndata:image/png;base64,iVBORw0KGgoAAAANSUhEUgAAAAoAAAAKCAYAAACNMs+9AAAAFUlEQVQYV2P8z8BQz0AEYBxVOHIVAvcHBQHzKSECAAAAAElFTkSuQmCC\ndata:image/png;base64,/9j/4AAQSkZJRgABAQEASABIAAD/2wBDAAgGBgcGBQgHBwcJCQgKDBQNDAsLDBkSEw8UHRofHh0aHBwgJC4nICIsIxwcKDcpLDAxNDQ0Hyc5PTgyPC4zNDL/2wBDAQkJCQwLDBgNDRgyIRwhMjIyMjIyMjIyMjIyMjIyMjIyMjIyMjIyMjIyMjIyMjIyMjIyMjIyMjIyMjIyMjIyMjL/wAARCAABAAEDASIAAhEBAxEB/8QAHwAAAQUBAQEBAQEAAAAAAAAAAAECAwQFBgcICQoL/8QAFBABaaaaAAAAAAAAAAAAAAAAAAAAAP/EABQRAQAAAAAAAAAAAAAAAAAAAAD/2gAMAwEAAhEDEQA/ALQAB//Z\n\nThe flickering started Monday after a Windows Update. It's a Dell U2722D connected\nvia DisplayPort to my docking station (Dell WD19S). The built-in laptop screen is\nfine. I've tried a different DisplayPort cable already \u2014 same issue.\n\nPriya Nair\nRisk Management, Building 2, 7th floor",
    "reporter": {
      "name": "Priya Nair",
      "email": "priya.nair@contoso.com",
      "department": "Risk Management"
    },
    "created_at": "2026-03-18T09:00:00Z",
    "channel": "email",
    "attachments": []
  },
  {
    "ticket_id": "INC-5003",
    "subject": "Cannot access SharePoint after migration",
    "description": "<html><body style=\"font-family:Calibri,sans-serif;font-size:11pt\"><div style=\"margin:0;padding:0\"><p><b>Hi IT Team,</b></p><p style=\"color:#1F4E79\">Since the SharePoint migration last Friday I can&rsquo;t open the <b>Compliance Policy Library</b> site. I get a &ldquo;403 Forbidden&rdquo; error every time I click the link.</p><p>Steps I&apos;ve tried:</p><ol><li>Cleared browser cache &amp; cookies</li><li>Tried Edge, Chrome, and Firefox &mdash; same result</li><li>Verified my account at <u>myaccount.microsoft.com</u> &mdash; looks fine</li><li>Asked my manager Deirdre who can access it fine from her machine</li></ol><p>My URL is: <a href=\"https://contoso.sharepoint.com/sites/CompliancePolicyLib\">https://contoso.sharepoint.com/sites/CompliancePolicyLib</a></p><p style=\"font-size:9pt;color:gray\">Sent from Outlook for Windows</p><p style=\"font-size:8pt;color:gray\">CONFIDENTIALITY NOTICE: This email and any attachments are for the exclusive and confidential use of the intended recipient. If you are not the intended recipient, please do not read, distribute, or take action based on this message.&nbsp;&nbsp;</p></div></body></html>",
    "reporter": {
      "name": "Aiden O'Sullivan",
      "email": "aiden.osullivan@contoso.com",
      "department": "Compliance"
    },
    "created_at": "2026-03-18T09:00:00Z",
    "channel": "email",
    "attachments": []
  },
  {
    "ticket_id": "INC-5004",
    "subject": "Printer producing garbled output \u2014 urg\u00ebnt",
    "description": "Hi,\n\nThe printer on the 3rd floor (HP LaserJet MFP M634) is printing garbled\ncharacters on every document. Here\u2019s what the output looks like:\n\n\u00c3\u00a9\u00c3\u00b1\u00c3\u00bc\u00c3\u00a8\u00c2\u00ab\u00c2\u00bb \u00ef\u00bf\u00bd\u00ef\u00bf\u00bd\u00ef\u00bf\u00bd R\u00c3\u00a9port_Q1_2026.xlsx \u00e2\u0080\u0093 Page 1 of 4\n\u00c3\u0081\u00c3\u00a7\u00c3\u00a7\u00c3\u00a8\u00c3\u0178\u00c3\u0178 D\u00c3\u00a8ni\u00c3\u00a8d: Pl\u00c3\u00a8\u00c3\u00a0s\u00c3\u00a8 cont\u00c3\u00a0ct IT\n\nI\u2019ve tried restarting the printer and switching paper trays. My colleague\nFatima confirmed it\u2019s happening for her documents too. We need this fixed\ntoday \u2014 we have a board presentation to print.\n\nRegards,\nWei Chen\nFinance, Building 1, 3rd floor, New York",
    "reporter": {
      "name": "Wei Chen",
      "email": "wei.chen@contoso.com",
      "department": "Finance"
    },
    "created_at": "2026-03-18T09:00:00Z",
    "channel": "email",
    "attachments": []
  },
  {
    "ticket_id": "INC-5005",
    "subject": "Slack integration broken \ud83d\udea8\ud83d\udea8\ud83d\udea8",
    "description": "\ud83d\udea8\ud83d\udea8\ud83d\udea8 URGENT \ud83d\udea8\ud83d\udea8\ud83d\udea8\n\nHeyy so the Slack \u2194\ufe0f Jira integration is totally broken \ud83d\ude2d\ud83d\ude2d\ud83d\ude2d\nWhen I create a ticket in #trading-incidents it used to auto-create a Jira issue \ud83d\udccb but now NOTHING happens \u274c\u274c\n\nI\u2019ve checked:\n\u2705 Slack app is still installed in our workspace\n\u2705 I can see the Jira bot in the channel\n\u274c But the /jira create command gives me \ud83d\udc49 \"Oops! Something went wrong (error 502)\" \ud83d\udc48\n\nThis is blocking our whole incident workflow \ud83d\udd25\ud83d\udd25\ud83d\udd25 we literally cannot track prod issues rn \ud83d\udca9\n\npls help asap \ud83d\ude4f\ud83d\ude4f\ud83d\ude4f\n\n\u2014 Deshawn\n\ud83d\udcbc Institutional Trading\n\ud83d\udccd NYC Building 4, 8th floor",
    "reporter": {
      "name": "Deshawn Carter",
      "email": "deshawn.carter@contoso.com",
      "department": "Institutional Trading"
    },
    "created_at": "2026-03-18T09:00:00Z",
    "channel": "chat",
    "attachments": []
  },
  {
    "ticket_id": "INC-5006",
    "subject": "Outlook keeps crashing \u2014 error details inside",
    "description": "Outlook crashes every time I open a specific email from the Legal team.\n\nHere's the error from Event Viewer (it repeated many times):\n\nFaulting application name: OUTLOOK.EXE, version: 16.0.18227.20162\nFaulting module name: mso40uiwin32client.dll, version: 16.0.18227.20162\nException code: 0xc0000005\nFault offset: 0x00000000005a3b10\nFaulting application name: OUTLOOK.EXE, version: 16.0.18227.20162\nFaulting module name: mso40uiwin32client.dll, version: 16.0.18227.20162\nException code: 0xc0000005\nFault offset: 0x00000000005a3b10\nFaulting application name: OUTLOOK.EXE, version: 16.0.18227.20162\nFaulting module name: mso40uiwin32client.dll, version: 16.0.18227.20162\nException code: 0xc0000005\nFault offset: 0x00000000005a3b10\nFaulting application name: OUTLOOK.EXE, version: 16.0.18227.20162\nFaulting module name: mso40uiwin32client.dll, version: 16.0.18227.20162\nException code: 0xc0000005\nFault offset: 0x00000000005a3b10\nFaulting application name: OUTLOOK.EXE, version: 16.0.18227.20162\nFaulting module name: mso40uiwin32client.dll, version: 16.0.18227.20162\nException code: 0xc0000005\nFault offset: 0x00000000005a3b10\n\nThis is the only email that causes it. All other emails open fine.\nI'm on Windows 11 with Microsoft 365 Apps, Current Channel.\n\nNadia Al-Rashid\nLegal, Building 2, 4th floor, New York",
    "reporter": {
      "name": "Nadia Al-Rashid",
      "email": "nadia.al-rashid@contoso.com",
      "department": "Legal"
    },
    "created_at": "2026-03-18T09:00:00Z",
    "channel": "portal",
    "attachments": []
  },
  {
    "ticket_id": "INC-5007",
    "subject": "Badge not working at Building 6 turnstile",